{
  "schema_version": "1.0",
  "notice": "Original argument-planning aids, not manuscript text or scientific evidence. Canonical entries and guides own the language. Study links are navigation only; no new primary-paper audit or writing-benefit validation was performed. Use only supplied verified facts and omit unsupported moves.",
  "audit": {
    "status": "existing_library_navigation_only",
    "new_primary_paper_audit": false,
    "note": "These compact frames reorganize existing library guidance. Existing study limitations still apply; references do not establish a source claim, prevalence, independent review, or causal writing benefit."
  },
  "relations": ["tradeoff", "component_contribution", "null_or_saturation", "regime_reversal", "scoped_gap", "literature_comparison", "principal_result"],
  "experiment_types": ["efficiency", "ablation", "sensitivity", "generalization", "literature", "main_result"],
  "frames": [
    {
      "id": "argument.tradeoff",
      "sections": ["experiments"],
      "intents": ["compare", "contrast", "evidence", "limit", "scope"],
      "relations": ["tradeoff"],
      "experiment_types": ["efficiency", "sensitivity", "main_result"],
      "question": "Which measured benefit is accompanied by which measured cost?",
      "evidence_requirements": ["A named comparator and comparable protocol for both axes, including material resource differences.", "Values, units, direction, denominator, aggregation and supplied uncertainty for the benefit and cost."],
      "moves": ["State the bounded benefit and its comparison axis.", "Place the accompanying cost beside that benefit, retaining its magnitude and conditions.", "Conclude only for the tested operating conditions; state an operating choice only when supplied."],
      "boundary": "An observed trade-off does not establish causation, a universal optimum, or unqualified superiority. Keep required standalone values even when the corresponding table is unavailable.",
      "entry_ids": ["general.sentence-pattern.result-tradeoff.001", "general.usage-note.result-display-allocation.001"],
      "guide_refs": [{"id": "experiments.analysis", "locator": "/moves/3"}],
      "study_refs": [{"path": "library/studies/experimental_narrative_2026-10.json", "locator": "/annotations/6/transfer_rule"}],
      "provenance": "original_synthesis"
    },
    {
      "id": "argument.ablation",
      "sections": ["experiments"],
      "intents": ["evidence", "compare", "causal_caution"],
      "relations": ["component_contribution"],
      "experiment_types": ["ablation"],
      "question": "What does the controlled component change establish in this setting?",
      "evidence_requirements": ["A recoverable full-model reference, changed factor, matched variants, and any retuning or resource differences.", "Component contrasts with supplied uncertainty; factorial variants and a common reference are required before discussing interactions."],
      "moves": ["Identify the component question and the controlled contrast.", "Select the contrast that distinguishes the tested alternatives, including null or adverse outcomes.", "State the supported component contribution; discuss non-additivity only when the factorial evidence permits it."],
      "boundary": "A component comparison does not prove universal necessity or uniquely identify a mechanism. Missing uncertainty and unmatched factors must remain visible.",
      "entry_ids": ["general.sentence-pattern.ablation-interaction.001", "general.sentence-pattern.caption-ablation.001"],
      "guide_refs": [{"id": "experiments.analysis", "locator": "/moves/2"}],
      "study_refs": [{"path": "library/studies/section_writing_2026-08.json", "locator": "/observations/1"}],
      "provenance": "original_synthesis"
    },
    {
      "id": "argument.null-saturation",
      "sections": ["experiments"],
      "intents": ["evidence", "limit", "scope", "quantify"],
      "relations": ["null_or_saturation"],
      "experiment_types": ["sensitivity", "ablation", "main_result"],
      "question": "Where is an advantage undetected, unstable, or no longer increasing?",
      "evidence_requirements": ["The tested range, named contrast, and supplied estimates and uncertainty.", "For saturation, multiple measured settings that support the claimed trend; for an inferential null, the actual test or interval design."],
      "moves": ["Identify the tested range or condition in which the favorable claim weakens.", "Give the contrast, trend or uncertainty that establishes that boundary.", "Limit the conclusion to the observed range and distinguish an undetected difference from demonstrated equivalence."],
      "boundary": "Do not invent a significance test, infer equivalence from a noisy estimate, or extrapolate a plateau beyond the measured range.",
      "entry_ids": ["general.sentence-pattern.result-null.001", "general.usage-note.result-narrative.001"],
      "guide_refs": [{"id": "experiments.analysis", "locator": "/moves/2"}],
      "study_refs": [{"path": "library/studies/experimental_narrative_2026-10.json", "locator": "/limitations/0"}],
      "provenance": "original_synthesis"
    },
    {
      "id": "argument.regime-reversal",
      "sections": ["experiments"],
      "intents": ["compare", "contrast", "evidence", "scope"],
      "relations": ["regime_reversal"],
      "experiment_types": ["generalization", "sensitivity", "main_result"],
      "question": "Which changed condition reverses the observed comparison?",
      "evidence_requirements": ["Comparable results for each named regime and the same comparison axis.", "Regime-specific estimates, uncertainty and denominator; any aggregate remains distinct from its subsets."],
      "moves": ["State where the advantage holds and where the comparison reverses.", "Anchor both sides of the reversal with their exact conditions and evidence locations.", "Conclude that the comparison is regime-dependent without inventing an explanation."],
      "boundary": "A favorable aggregate cannot conceal an adverse regime, and an aggregate value cannot be assigned to a subset. An unmeasured mechanism remains unestablished.",
      "entry_ids": ["general.sentence-pattern.result-consistency.001", "general.usage-note.result-display-allocation.001"],
      "guide_refs": [{"id": "experiments.analysis", "locator": "/moves/3"}],
      "study_refs": [{"path": "library/studies/experimental_narrative_2026-10.json", "locator": "/annotations/2/transfer_rule"}],
      "provenance": "original_synthesis"
    },
    {
      "id": "argument.scoped-gap",
      "sections": ["introduction"],
      "intents": ["gap", "motivate", "scope"],
      "relations": ["scoped_gap"],
      "experiment_types": ["literature"],
      "question": "Which verified constraint limits the target capability under a named condition?",
      "evidence_requirements": ["Primary-source checks for the closest relevant methods and the precise assumption or requirement being compared.", "Evidence for the stated consequence in the target setting, with known exceptions and the coverage boundary."],
      "moves": ["Name the task and the closest relevant approaches within the verified coverage.", "Connect the verified constraint to its supported consequence under the stated condition.", "Define the resulting research question without asserting that all prior work shares the constraint."],
      "boundary": "A design difference alone is not a deficiency. Library references cannot verify a literature gap; source checking is still required before drafting one.",
      "entry_ids": ["general.sentence-pattern.abstract-gap.001", "general.sentence-pattern.intro-restrictive-assumption.001"],
      "guide_refs": [{"id": "introduction", "locator": "/moves/2"}],
      "study_refs": [{"path": "library/studies/section_writing_2026-08.json", "locator": "/observations/3"}],
      "provenance": "original_synthesis"
    },
    {
      "id": "argument.related-work-comparison",
      "sections": ["related_work"],
      "intents": ["compare", "contrast", "position"],
      "relations": ["literature_comparison"],
      "experiment_types": ["literature"],
      "question": "How do the closest methods differ along a verified technical axis?",
      "evidence_requirements": ["Primary-paper locators for each compared property, including the closest method and material exceptions.", "An explicit axis such as assumption, supervision, data, method, metric, compute or deployment setting; comparable protocols for any result ranking."],
      "moves": ["Establish the shared problem and explicit comparison axis.", "Synthesize the verified similarities and differences, retaining exceptions within each family.", "Position the present method through the supported distinction without turning a difference into a performance claim."],
      "boundary": "No invented citation, paper property, family-wide limitation or cross-protocol ranking. The linked library study is navigation, not verification of the literature being compared.",
      "entry_ids": ["general.sentence-pattern.intro-approach-axes.001", "general.sentence-pattern.intro-restrictive-assumption.001"],
      "guide_refs": [{"id": "related_work", "locator": "/moves/0"}, {"id": "related_work", "locator": "/moves/2"}],
      "study_refs": [{"path": "library/studies/section_writing_2026-08.json", "locator": "/observations/0"}],
      "provenance": "original_synthesis"
    },
    {
      "id": "argument.abstract-result",
      "sections": ["abstract"],
      "intents": ["evidence", "quantify", "compare", "scope"],
      "relations": ["principal_result"],
      "experiment_types": ["main_result"],
      "question": "Which verified result answers the principal question within its evaluated scope?",